{
  "schema_id": "https://axym.dev/schemas/v1/governance/action-contract-evidence-packet.schema.json",
  "schema_version": "v1",
  "packet_id": "pac-4b7f1402784256ce:1",
  "contract": {
    "id": "pac-4b7f1402784256ce",
    "family_id": "pacf-55f758ded9e42f84",
    "revision": 1,
    "action": "release_publish",
    "target": "built_in:deploy_workflow+built_in:kubernetes+built_in:release_automation",
    "environment": "production",
    "policy_digest": "",
    "owner": "",
    "authorization": [
      {
        "evidence_refs": [
          ".gait/policy.yaml",
          "approval_status=unapproved",
          "baseline:discovered_surface",
          "binding_subject:cloud_admin_key",
          "binding_subject:workflow_kubernetes_deploy",
          "credential_access:true",
          "credential_likely_scope:cloud_or_infra_access",
          "credential_reference_observed",
          "credential_referenced_by_workflow:true",
          "credential_target_system:kubernetes",
          "detector:workflow_credential_kind",
          "intent:release",
          "matched_target:built_in:deploy_workflow",
          "matched_target:built_in:kubernetes",
          "matched_target:built_in:release_automation",
          "owner:system:@local/demo",
          "permission:deploy.write",
          "permission:headless.execute",
          "permission:proc.exec",
          "permission:pull_request.write",
          "permission:repo.write",
          "permission:secret.read",
          "policy:gait://release-control",
          "provenance_subject:broad_pat",
          "provenance_subject:cloud_admin_key",
          "repo_workflow_secret_correlation",
          "scope:cloud_or_infra_access",
          "subject:cloud_admin_key",
          "target_system:kubernetes",
          "wch-86520c168374",
          "workflow_credential_kind",
          "workflow_secret_refs",
          "write_path:deploy",
          "write_path:write_capable",
          "write_path_class:deploy_write",
          "write_path_class:pr_write",
          "write_path_class:release_write",
          "write_path_class:repo_write",
          "write_path_class:secret_bearing_execution",
          "write_path_class:write"
        ],
        "evidence_state": "unknown",
        "freshness_state": "unknown",
        "kind": "requester_identity",
        "reason_codes": [
          "authority:requester_identity:missing",
          "authority:requester_identity:unknown"
        ],
        "required_constraint": "requester_identity:required",
        "requirement_id": "pacr-2235a80f56736851"
      },
      {
        "evidence_refs": [
          ".gait/policy.yaml",
          "approval_status=unapproved",
          "baseline:discovered_surface",
          "binding_subject:cloud_admin_key",
          "binding_subject:workflow_kubernetes_deploy",
          "credential_access:true",
          "credential_likely_scope:cloud_or_infra_access",
          "credential_reference_observed",
          "credential_referenced_by_workflow:true",
          "credential_target_system:kubernetes",
          "detector:workflow_credential_kind",
          "intent:release",
          "matched_target:built_in:deploy_workflow",
          "matched_target:built_in:kubernetes",
          "matched_target:built_in:release_automation",
          "owner:system:@local/demo",
          "permission:deploy.write",
          "permission:headless.execute",
          "permission:proc.exec",
          "permission:pull_request.write",
          "permission:repo.write",
          "permission:secret.read",
          "policy:gait://release-control",
          "provenance_subject:broad_pat",
          "provenance_subject:cloud_admin_key",
          "repo_workflow_secret_correlation",
          "scope:cloud_or_infra_access",
          "subject:cloud_admin_key",
          "target_system:kubernetes",
          "wch-86520c168374",
          "workflow_credential_kind",
          "workflow_secret_refs",
          "write_path:deploy",
          "write_path:write_capable",
          "write_path_class:deploy_write",
          "write_path_class:pr_write",
          "write_path_class:release_write",
          "write_path_class:repo_write",
          "write_path_class:secret_bearing_execution",
          "write_path_class:write"
        ],
        "evidence_state": "unknown",
        "freshness_state": "unknown",
        "kind": "delegation_root",
        "observed_value": "authority-16b128ce8beb8f5d",
        "reason_codes": [
          "authority:delegation_root:unknown"
        ],
        "required_constraint": "delegation_root:required",
        "requirement_id": "pacr-44d1e4b8f062084d"
      },
      {
        "evidence_refs": [
          ".gait/policy.yaml",
          "approval_status=unapproved",
          "baseline:discovered_surface",
          "binding_subject:cloud_admin_key",
          "binding_subject:workflow_kubernetes_deploy",
          "credential_access:true",
          "credential_likely_scope:cloud_or_infra_access",
          "credential_reference_observed",
          "credential_referenced_by_workflow:true",
          "credential_target_system:kubernetes",
          "detector:workflow_credential_kind",
          "intent:release",
          "matched_target:built_in:deploy_workflow",
          "matched_target:built_in:kubernetes",
          "matched_target:built_in:release_automation",
          "owner:system:@local/demo",
          "permission:deploy.write",
          "permission:headless.execute",
          "permission:proc.exec",
          "permission:pull_request.write",
          "permission:repo.write",
          "permission:secret.read",
          "policy:gait://release-control",
          "provenance_subject:broad_pat",
          "provenance_subject:cloud_admin_key",
          "repo_workflow_secret_correlation",
          "scope:cloud_or_infra_access",
          "subject:cloud_admin_key",
          "target_system:kubernetes",
          "wch-86520c168374",
          "workflow_credential_kind",
          "workflow_secret_refs",
          "write_path:deploy",
          "write_path:write_capable",
          "write_path_class:deploy_write",
          "write_path_class:pr_write",
          "write_path_class:release_write",
          "write_path_class:repo_write",
          "write_path_class:secret_bearing_execution",
          "write_path_class:write"
        ],
        "evidence_state": "unknown",
        "freshness_state": "unknown",
        "kind": "affected_system_owner",
        "observed_value": "owner:system:@local/demo",
        "reason_codes": [
          "authority:affected_system_owner:unknown"
        ],
        "required_constraint": "affected_system_owner:required",
        "requirement_id": "pacr-8a0684edd81a5be1"
      },
      {
        "evidence_refs": [
          ".gait/policy.yaml",
          "approval_status=unapproved",
          "baseline:discovered_surface",
          "binding_subject:cloud_admin_key",
          "binding_subject:workflow_kubernetes_deploy",
          "credential_access:true",
          "credential_likely_scope:cloud_or_infra_access",
          "credential_reference_observed",
          "credential_referenced_by_workflow:true",
          "credential_target_system:kubernetes",
          "detector:workflow_credential_kind",
          "intent:release",
          "matched_target:built_in:deploy_workflow",
          "matched_target:built_in:kubernetes",
          "matched_target:built_in:release_automation",
          "owner:system:@local/demo",
          "permission:deploy.write",
          "permission:headless.execute",
          "permission:proc.exec",
          "permission:pull_request.write",
          "permission:repo.write",
          "permission:secret.read",
          "policy:gait://release-control",
          "provenance_subject:broad_pat",
          "provenance_subject:cloud_admin_key",
          "repo_workflow_secret_correlation",
          "scope:cloud_or_infra_access",
          "subject:cloud_admin_key",
          "target_system:kubernetes",
          "wch-86520c168374",
          "workflow_credential_kind",
          "workflow_secret_refs",
          "write_path:deploy",
          "write_path:write_capable",
          "write_path_class:deploy_write",
          "write_path_class:pr_write",
          "write_path_class:release_write",
          "write_path_class:repo_write",
          "write_path_class:secret_bearing_execution",
          "write_path_class:write"
        ],
        "evidence_state": "unknown",
        "freshness_state": "unknown",
        "kind": "separation_of_duties",
        "reason_codes": [
          "authority:separation_of_duties:missing",
          "authority:separation_of_duties:unknown"
        ],
        "required_constraint": "requester_must_not_approve",
        "requirement_id": "pacr-bf2fc3de3afd4266"
      },
      {
        "evidence_refs": [
          ".gait/policy.yaml",
          "approval_status=unapproved",
          "baseline:discovered_surface",
          "binding_subject:cloud_admin_key",
          "binding_subject:workflow_kubernetes_deploy",
          "credential_access:true",
          "credential_likely_scope:cloud_or_infra_access",
          "credential_reference_observed",
          "credential_referenced_by_workflow:true",
          "credential_target_system:kubernetes",
          "detector:workflow_credential_kind",
          "intent:release",
          "matched_target:built_in:deploy_workflow",
          "matched_target:built_in:kubernetes",
          "matched_target:built_in:release_automation",
          "owner:system:@local/demo",
          "permission:deploy.write",
          "permission:headless.execute",
          "permission:proc.exec",
          "permission:pull_request.write",
          "permission:repo.write",
          "permission:secret.read",
          "policy:gait://release-control",
          "provenance_subject:broad_pat",
          "provenance_subject:cloud_admin_key",